{
  "probe": "planner",
  "summary": "在现有 reportEvent 接口上扩展实时模式，使支付成功事件可跳过批量队列即时上报，同时保持多版本客户端与服务端的兼容性，确保上报失败不阻塞支付流程。",
  "scope": {
    "in_scope": [
      "reportEvent 接口增加可选实时模式触发机制",
      "实时模式事件跳过本地批量队列直接上报",
      "实时模式客户端生成 event_id 并随事件上报",
      "原生桥实时上报通道及失败降级到批量队列",
      "多版本客户端 SDK 与服务端的兼容处理",
      "支付成功页的非阻塞接入与灰度发布"
    ],
    "out_of_scope": [
      "新建独立消息平台、数据库或通用任务系统",
      "非支付事件改为实时上报",
      "修改服务端核心去重存储架构",
      "强制旧版本 App 升级 SDK"
    ]
  },
  "decisions": [
    {
      "title": "实时模式触发方式",
      "decision": "扩展 reportEvent 函数签名为 reportEvent(name, payload, options?)，其中 options.mode 为 'realtime' 或 'batch'（默认 'batch'）。",
      "reason": "在不新增平行 API 的前提下显式声明上报意图，类型安全且对旧调用方零破坏；旧版本 SDK 不支持第三参数时继续走批量，业务方按需升级。"
    },
    {
      "title": "实时事件标识与去重",
      "decision": "实时模式事件由客户端在入参 payload 中注入或自动补全 event_id（UUID），随事件原样上报。",
      "reason": "服务端已按 event_id 去重，旧客户端无此字段；仅对实时事件补全可最小化影响范围，同时满足服务端去重要求。"
    },
    {
      "title": "上报通道复用策略",
      "decision": "实时事件复用现有原生桥网络通道，但跳过本地批量缓存队列，由原生桥立即执行 HTTP POST；若失败则将该事件写入本地批量存储，随下次批量补报。",
      "reason": "不新建消息平台或独立存储，利用现有批量落盘能力作为实时失败的降级兜底，确保支付事件不丢失且不阻塞页面。"
    },
    {
      "title": "服务端协议兼容",
      "decision": "保持现有事件接收接口，通过支持单条 JSON Object 或原有 JSON Array 来兼容实时与批量上报；服务端去重逻辑优先使用 event_id，不存在时保持原兜底策略。",
      "reason": "线上存在两个服务端版本，协议改动需向后兼容；同端点可减少运维复杂度，且旧版本服务端对新增字段透传/忽略即可。"
    }
  ],
  "implementation_steps": [
    {
      "order": 1,
      "title": "协议与类型定义",
      "details": [
        "扩展 reportEvent TypeScript 类型，增加可选参数 options?: { mode?: 'realtime' | 'batch' }",
        "定义实时事件必须字段：event_id（string，UUID v4 或同等级唯一标识）",
        "约定原生桥透传字段：mode 与 event_id 对旧版本原生桥无侵入"
      ],
      "dependencies": [],
      "outputs": [
        "JS SDK 接口类型定义文档",
        "事件 payload 规范文档"
      ]
    },
    {
      "order": 2,
      "title": "JS SDK 层实现",
      "details": [
        "reportEvent 内部判断 options.mode === 'realtime' 时进入实时分支",
        "实时分支为 payload 自动注入 event_id（若调用方未提供）",
        "调用原生桥实时上报接口并返回 Promise；业务侧通过 fire-and-forget 或弱 catch 保证非阻塞",
        "无 options 或 mode !== 'realtime' 时保持现有批量队列逻辑不变"
      ],
      "dependencies": [
        "步骤1"
      ],
      "outputs": [
        "更新后的 JS SDK 包",
        "JS SDK 单元测试用例"
      ]
    },
    {
      "order": 3,
      "title": "原生桥层实现（iOS & Android）",
      "details": [
        "原生桥新增或复用即时上报接口，接收单条事件数据",
        "实时事件直接发起 HTTP POST，超时设置短于批量（如 3s）",
        "实时请求失败（网络异常、HTTP 5xx/超时）时，将事件写入本地批量数据库/文件队列",
        "返回明确错误码给 JS，以便业务层感知但不阻塞"
      ],
      "dependencies": [
        "步骤1",
        "JS SDK 与原生桥确认接口契约"
      ],
      "outputs": [
        "新版原生桥 SDK",
        "原生桥错误码与降级策略文档"
      ]
    },
    {
      "order": 4,
      "title": "服务端接口适配",
      "details": [
        "确认并扩展现有事件接收端点，支持解析单条 JSON Object 与原有 JSON Array",
        "去重逻辑更新：优先提取 event_id，存在时作为去重键；不存在时保持原兜底逻辑",
        "确保旧服务端版本对新增字段透传或忽略，不抛异常"
      ],
      "dependencies": [
        "步骤1"
      ],
      "outputs": [
        "服务端兼容层代码",
        "接口契约文档"
      ]
    },
    {
      "order": 5,
      "title": "支付业务方接入",
      "details": [
        "支付成功页调用 reportEvent('pay_success', payload, { mode: 'realtime' })",
        "调用后不 await 或仅做无阻塞日志处理，确保支付结果页正常流转",
        "若需兼容旧版 SDK，添加参数长度或 feature detection"
      ],
      "dependencies": [
        "步骤2",
        "步骤3发布到支付业务可依赖版本"
      ],
      "outputs": [
        "支付页更新代码",
        "接入与降级文档"
      ]
    },
    {
      "order": 6,
      "title": "灰度发布与监控",
      "details": [
        "JS SDK 按业务灰度，支付页先灰度",
        "原生桥随新版 App 发版",
        "监控实时上报成功率、延迟、降级到批量的比例"
      ],
      "dependencies": [
        "步骤2",
        "步骤3",
        "步骤4",
        "步骤5"
      ],
      "outputs": [
        "发布计划",
        "监控大盘配置"
      ]
    }
  ],
  "failure_handling": [
    "实时上报网络超时或失败：原生桥重试 1 次后仍失败，写入本地批量队列，随下次批量补报",
    "原生桥不支持实时接口：JS SDK 检测到后自动降级为批量模式上报",
    "event_id 生成异常：降级为批量模式，避免无 id 的实时事件导致服务端去重失效",
    "服务端返回 4xx：停止对该事件重试，记录日志，不阻塞支付页",
    "旧版本客户端：无 mode 参数支持，继续走原有批量队列，业务方无需改造"
  ],
  "test_plan": [
    "JS SDK 单元测试：mode=realtime 时调用原生桥实时接口，mode 缺失时走批量队列",
    "集成测试：支付成功事件触发后 1s 内到达服务端",
    "失败降级测试：模拟飞行模式，验证事件落入本地批量队列，网络恢复后成功补报",
    "兼容性测试：旧版本 SDK 上报事件服务端正常接收且无异常",
    "去重测试：使用相同 event_id 重复上报实时事件，服务端仅保留一条",
    "非阻塞测试：支付页实时上报接口返回 500 或超时，支付结果页正常展示"
  ],
  "acceptance_criteria": [
    "支付成功事件通过 reportEvent(name, payload, { mode: 'realtime' }) 调用后，p99 上报延迟小于 1 秒",
    "实时上报失败时，支付结果页无阻塞、无异常弹窗、支付状态不受影响",
    "服务端对带 event_id 的实时事件按 event_id 去重，重复上报仅记录一次",
    "未升级的旧客户端事件服务端正常接收，批量上报逻辑无回归",
    "实时上报失败事件最终通过批量队列补报，事件丢失率低于 0.1%"
  ],
  "open_decisions": [
    "原生桥是否已存在即时上报接口，或需要全新开发原生层实时网络通道",
    "现有服务端批量接收接口的具体协议格式（单条对象 vs 数组）及是否需要新增独立端点",
    "event_id 具体生成算法（UUID v4、时间戳+随机数、雪花算法）及其在弱网下的时钟回退处理",
    "实时失败降级写入本地批量队列时，是否需要在 payload 中增加降级标记以便服务端区分原始上报时间与补报时间"
  ]
}
